Yeni Madde No,Yeni Madde İçeriği,Eşleşen Eski Madde,Benzerlik,Durum
MADDE 9,sağlık tesis aracı kuruluş yer alan performans kriter doğrultu ushaş tarafından yıl bir değerlendiril yapılan değerlendir netice sağlık tesis aracı kuruluş yeterlilik portal üzerinde ilgili bildiril performans kriter bakımından kısmen yeterli yetersiz olarak değerlendiri len sağlık tesis aracı kuruluş tespit tarihî itibaren içinde kontrol değerlendir sine tabi tutul kontrol değerlendirme sonuç yeterlilik sağlanamadık tespit linde kısmen yeterlilik hali yetersizlik hali altı süre yetki belge askı alın yetki belge askı alınan sağlık tesis aracı ruluşlar askı süre son erme itibaren içinde ikinci kontrol değerlendirme tabi tutul kinci kontrol değerlendirme sonuç yeterlilik sağlanamadık tespit linde yetki belge iptal edil nisan 2025 sayı 32882 resm gazete sayfa üçüncü bölüm turist sağlık turist sağlık kapsam hizmet,MADDE 1,0.088,Yeni Madde
MADDE 10,ülke toplantı kongre ticari turizm amaçlı süreli olarak kalan yabancı ülke bulunduk sıra gelişen hastalık acil durum kamu kurum kuruluş üniversite özel sağlık kuruluş sunulan sağlık hiz met yararlanabil ani gelişen hastalık acil durum sonra devam nitelik dek sağlık hizmet yetki belge bulunmayan sağlık tesis sunula acil sağlık hizmet acil hasta nakil ücret karşılık sunul acil sağlık hizmet almak sağlık tesis başvuru yapan yabancı hasta kabul edilme gerekli tıbbi müdahale kayıtsız şartsız gecikmeksizin yapılma zorunlu hizmet bedel tahsil ilgili işlem acil müdahale bakım sağlandık sonra yapıl trafik kaza sonuç veril sağlık hizmet bedel Türk vatandaş yabancı uyruklu kişi uyruk sosyal güvence olup olmadık bakılmaksızın ilgili mevzuat gerek sosyal güvenlik kurum tahsil edil trafik kaza kişi bizzat kendi tedavi bedel talep edil ancak trafik kaza nedeniyle acil sağlık hiz met alan kişi istek bağlı ilave seyahat sigorta var sigorta fatura edilerek poliçe kapsam öde tahsil edil dördüncü bölüm fiyatlandır fatura şlemleri tanıtım bilgilendir fiyatlandır,MADDE 1,0.076,Yeni Madde
MADDE 11,uluslararası sağlık turizm kapsam sunulan sağlık hizmet deli bakanlık belirlen sağlık tesis bakanlık belirlenen sağlık turizm fiyat tarife belirlenen usul esas uymak yükümlü fatura düzenlenme veril belge,MADDE 1,0.043,Yeni Madde
MADDE 12,sağlık tesis tarafından sağlık turizm kapsam hizmet alan ilgili mevzuat göre satış fiş fatura düzenlenme zorunlu satış fiş fatura ekin hasta sunulan sağlık hizmet ayrıntılı döküm birim fiyat gösteren belge düzenlen ayrı hizmet alan kişi tarafından istenildiğinde aşağı belirtilen belge ücretsiz olarak verilme zorunlu sağlık tesis tarafından sağlık tesis kullanılıp bedel hasta alınan ilaç sarf malzeme tür miktar gösteren liste adli vaka ilişkin olan asıl verilmemek kayıt sağlık tesis şarıda yapılan bedel hasta tarafından ödenen laboratuvar tetkik tahlil sonuç rad yolojik görüntü dışarı satı alınan ilaç malzeme reçete aracı kuruluş tarafından uluslararası sağlık turist beraberinde refakatçi diğer yakın sunulan konakla ulaşım transfer tercümanlık danışmanlık hizmet talep edilen ret ayrıntılı döküm tanıtım bilgilendir,MADDE 1,0.083,Yeni Madde
MADDE 13,sağlık tesis aracı kuruluş 2023 tarihli 32263 sayılı resm gazete yayımlanan sağlık hizmet tanıtım bilgilendir faaliyet hak kın yönetmelik hüküm uygulan sağlık tesis aracı kuruluş yabancı dil seçenek bulunan internet site oluşturulma zorunlu nternet site yer alan kuruluş isim unvan sağlık tesis aracı kuruluş yetki belge unvan sahiplik ad uyumlu olmak zorun sağlık tesis yönetmelik kapsam al olduk akreditasyon belge sertifika internet site yayınlamak zorun sayfa resm gazete nisan 2025 sayı 32882 beş nci bölüm çeşitli son hüküm eğitim,MADDE 5,0.077,Yeni Madde
MADDE 14,uluslararası sağlık turizm alan gerçekleştiril sertifikalı eği tim 2014 tarihli 28903 sayılı resm gazete yayımlanan sağlık bakanlık sertifi kal eğitim yönetmelik kapsam bakanlık eğitim vermek üzere yetkilendiril mer kez tarafından veril denetim,MADDE 1,0.117,Yeni Madde
MADDE 15,sağlık tesis aracı kuruluş 2023 tarihli 32372 sayılı resm gazete yayımlanan özel sağlık tesis denetim hakkında yönetmelik hüküm uygun olarak yer alan denetim sorgu idari yapt form belirtilen kriter göre denetlen yönetmelik belirtilen usul esas uymadık sağlık turizm faaliyet durdurulan yetki belge askı alınan iptal edilen sağlık tesis aracı kuruluş ticaret bakanlık kültür turizm bakanlık bakanlık bildiril aracı kuruluş uluslararası sağlık turizm kapsam yap olduk faaliyet ilgili olarak yönetmelik yer alan husus 663 sayılı kanun hüküm kararname nci madde ikinci fıkra bent uygunluk yön ushaş tarafından ğerlendirilir dari yapt,MADDE 5,0.112,Yeni Madde
MADDE 16,yönetmelik belirtilen usul esas uymayan hakkında yer alan idari yaptırım uygulan yapılan denetim esnasında sağlık turist tedavi olumsuz etkileyen hiz metin devam hali sağlık güvenlik tehlike sokan hizmet gecikmeksizin dur durulma gerektiren acil telafi güç durum ortay çıktık tespit hali yetki belge durum ortada kalkınca kadar sağlık tesis bakanlık aracı kuruluş ushaş tarafından askı alın sağlık tesis aracı kuruluş kayıt incelenme sonuç kayıt uygun suz olarak tutulduk tespit edilme durum yetki belge altı süre askı alın aynı fiilî bir yıl içinde tekrarlanma hali yetki belge iptal edil son bir yıl içinde sağlık turizm kapsam faaliyet göstermeyen sağlık tesis aracı kuruluş yetki belge iptal edil yetki belge iptal edilen kuruluş bir yıl süre yeni yetki belge düzenlen mez yürürlük kaldırılan yönetmelik,MADDE 1,0.12,Yeni Madde
MADDE 17,2017 tarihli 30123 sayılı resm gazete yayımlanan ulus lararası sağlık turizm turist sağlık hakkında yönetmelik yürürlük kaldırıl mevcut sağlık tesis aracı kuruluş uyum geç,MADDE 4,0.09,Yeni Madde
MADDE 1,yönetmelik yürürlük girdik tarih ön sağlık rizmi yetki belge al sağlık tesis aracı kuruluş yönetmelik yürürlük girdik tarih itibaren altı içinde yönetmelik hüküm uyum sağlamak zorun re sonunda uyum sağlamayan yetki belge iptal edil sağlık tesis ncı madde birinci fıkra bent yer alan yükümlülük 2025 tarihî kadar sağ sağlık tesis ncı madde birinci fıkra bent yer alan yükümlülük 2026 tarihî kadar sağ yürürlük,MADDE 4,0.221,Yeni Madde
MADDE 18,yönetmelik yayım tarihî yürürlük gir yürüt,MADDE 4,0.931,Benzer
MADDE 19,yönetmelik hüküm sağlık bakan yürüt nisan 2025 sayı 32882 resm gazete sayfa sayfa resm gazete nisan 2025 sayı 32882 nisan 2025 sayı 32882 resm gazete sayfa sayfa resm gazete nisan 2025 sayı 32882 nisan 2025 sayı 32882 resm gazete sayfa sayfa resm gazete nisan 2025 sayı 32882 nisan 2025 sayı 32882 resm gazete sayfa sayfa resm gazete nisan 2025 sayı 32882 nisan 2025 sayı 32882 resm gazete sayfa sayfa resm gazete nisan 2025 sayı 32882 nisan 2025 sayı 32882 resm gazete sayfa sayfa resm gazete nisan 2025 sayı 32882 tarım orman bakanlık yurt nde canli hayvan hayvansal ürün Naki lleri hakkinda yönet kte deği kli yapilmasina Dai yönet,MADDE 5,0.175,Yeni Madde
MADDE 1,2011 tarihli 28145 sayılı resm gazete yayımlanan yurt Çin canlı hayvan hayvansal ürün nakil hakkında yönetmelik üncü madde birinci fıkra bent yer alan düzenlenen veri taban alınan imzalı onaylı ibare imzalı olarak elektronik ortam düzenlenen şeklî değiştiril aynı fık ray aşağı bent eklen veteriner yol kontrol denetim istasyon canlı hayvan hayvansal ürün nakil vasıta nakil ilgili belge kontrol denetim yapıldık belgesiz nakil ilgili işlem yürütüldük bakanlık tarafından kurulan tesis,MADDE 3,0.143,Yeni Madde
MADDE 2,aynı yönetmelik nci madde birinci fıkra yer alan beş ibare şeklî değiştiril,MADDE 2,0.367,Yeni Madde
MADDE 3,aynı yönetmelik uncu madde aşağı fıkra eklen hayvan nakleden araç hayvan sahip bakanlık belirlenen veteriner yol kontrol denetim istasyon biri girmek nakledilen hayvan kontrol tirmekle yükümlü denetim istasyon girmeyen nakil vasıta sahip hayvan hibine kanun ncı madde birinci fıkra bent gerek idari para ceza veril stasyon denetim ilgili uygulan olan ilave hüküm bakanlık belirlen kanlık internet sayfa yayımlan,MADDE 3,0.145,Yeni Madde
MADDE 4,yönetmelik yayım tarihî yürürlük gir,MADDE 4,1.0,Benzer
